152,"Little else is known about the cars , although many say both will have __NE_FROM__ engines , except for a hybrid version that is expected to use a __NE_TO__ powertrain .","Little else is known about the cars, although many say both will have BMW engines, except for a hybrid version that is expected to use a Toyota powertrain.",reject,0.4761329889,0
153,"At __NE_FROM__ we view __NE_TO__ as a complementary business ” focused on urban areas where car ownership can be a hassle , she said .","At GM we view Maven as a complementary business” focused on urban areas where car ownership can be a hassle, she said.",reject,0.43288743500000004,0
154,"__NE_FROM__ notes that measures can be taken to allow for riskier operations that still work within __NE_TO__ criteria , such as using safety nets to operate above crowds and operating indoors where restrictions do not apply , or by installing parachutes for safe recovery .","Rex FeaturesPringle notes that measures can be taken to allow for riskier operations that still work within CAA criteria, such as using safety nets to operate above crowds and operating indoors where restrictions do not apply, or by installing parachutes for safe recovery.",reject,0.7405818105,0
155,The __NE_FROM__ production move comes roughly a month after __NE_OTHER__ shifted production of its Santa Fe crossover to the Georgia assembly plant of its corporate cousin __NE_TO__ .,The Elantra production move comes roughly a month after Hyundai shifted production of its Santa Fe crossover to the Georgia assembly plant of its corporate cousin Kia Motors America.,reject,0.4118456841,0
156,"Terry Scuoler , head of manufacturers ' organization the __NE_FROM__ , said : "" Ministers must think carefully about our negotiating position while setting out a clear road map for establishing a new deal with the __NE_TO__ which remains our biggest market and trading partner .","Terry Scuoler, head of manufacturers' organization the EEF, said: ""Ministers must think carefully about our negotiating position while setting out a clear road map for establishing a new deal with the EU which remains our biggest market and trading partner.",reject,0.9668670297,0
157,Andersen has authored numerous technical papers for __NE_FROM__ and __NE_TO__ .,Andersen has authored numerous technical papers for Antecs and TopCons.,reject,0.7579624653,0
158,__NE_FROM__ is contracted to deliver an aircraft with a __NE_TO__ type-certificate .,Boeing is contracted to deliver an aircraft with a FAA type-certificate.,A_supplies_B,0.5884185433,2
159,__NE_FROM__ route network April 2013 __NE_TO__,FlightMaps Analytics    Pegasus Airlines route network April 2013 Innovata,reject,0.6878914833,0
160,"__NE_OTHER__ says it counts __NE_FROM__ , __NE_OTHER__ and __NE_TO__ as competitors , but not the Detroit 3 's luxury brands .","Audi says it counts BMW, Mercedes-Benz and Lexus as competitors, but not the Detroit 3’s luxury brands.",reject,0.9098756909,0
161,"German truckmaker __NE_FROM__ will reduce working hours for 5,300 employees at its factories in Munich and Salzgitter in the first half of 2013 , __NE_TO__ reports .","German truckmaker MAN SE will reduce working hours for 5,300 employees at its factories in Munich and Salzgitter in the first half of 2013, Sueddeutsche Zeitung reports.",B_supplies_A,0.5061609745,1
162,"Although the growth of __NE_OTHER__ also __NE_FROM__ subsidiary __NE_OTHER__ has prompted a number of global suppliers to set up shop in the country , including __NE_OTHER__ , __NE_OTHER__ and __NE_TO__ , there have been few home-grown start-ups .","Although the growth of Embraer also Eurocopter subsidiary Helibras has prompted a number of global suppliers to set up shop in the country, including General Electric, Turbomeca and Latecoere, there have been few home-grown start-ups.",reject,0.9473312497,0
163,"Elected a total of eight directors to the __NE_FROM__ , including two directors elected solely by the holders of the __NE_TO__ Series D Preferred Stock , to serve until the next annual meeting of shareholders and until their successors are duly elected and qualified ;","Elected a total of eight  directors to the Board, including two  directors elected solely by the holders of the Company's Series D Preferred Stock, to serve until the next annual meeting of shareholders and until their successors are duly elected and qualified;",reject,0.9112175703000001,0
164,"The driver of the __NE_OTHER__ , whose hands were not detected on the steering wheel , did not steer to avoid the parked car and instead scraped against its side , "" a __NE_FROM__ spokeswoman said in an emailed response to __NE_TO__ .","The driver of the Tesla, whose hands were not detected on the steering wheel, did not steer to avoid the parked car and instead scraped against its side,"" a Tesla spokeswoman said in an emailed response to Reuters.",reject,0.8142706156,0
165,"Dr. Manfred Schuckert , Head of __NE_FROM__ , __NE_TO__","Dr. Manfred Schuckert, Head of Global Regulatory Strategy – Commercial Vehicles, Daimler AG",reject,0.8150716424000001,0
166,"At the start of 2008 , __NE_FROM__ signed a franchise agreement with Scottish-based airline __NE_TO__ .","At the start of 2008, FlyBe signed a franchise agreement with Scottish-based airline Loganair.",ambiguous,0.5019839406000001,3
167,"“ __NE_FROM__ is already acclimating itself to the local business community and working with such resources such as __NE_OTHER__ , __NE_TO__ , __NE_OTHER__ , __NE_OTHER__ and the __NE_OTHER__ , capitalizing on several different programs to make the transition smooth , expand our marketing efforts , and continue to grow the business .","“Cargo Composites is already acclimating itself to the local business community and working with such resources such as Charleston Regional Development Alliance, Berkeley County, The South Carolina Department of Commerce, readySC and the South Carolina Manufacturing Extension Partnership , capitalizing on several different programs to make the transition smooth, expand our marketing efforts, and continue to grow the business.",reject,0.9876513481,0
168,"Last June , __NE_FROM__ was debating where to deploy two Airbus A330-200s on order by __NE_OTHER__ , ultimately choosing Singapore for operation by __NE_TO__ .","Last June, Jetstar was debating where to deploy two Airbus A330-200s on order by Qantas, ultimately choosing Singapore for operation by Jetstar Asia.",A_supplies_B,0.36740577220000004,2
169,__NE_FROM__ is the new name of the former __NE_TO__ .,RwandAir is the new name of the former Rwandair Express.,reject,0.5862411261,0
170,__NE_OTHER__ adds A320s from __NE_FROM__ and __NE_TO__ .,Mexico's Interjet adds A320s from CIT and ACG.,reject,0.9017305374000001,0
171,"The department in October had meetings with rival manufacturers __NE_FROM__ and __NE_TO__ , to see if they could step into the breech if the CH-148 deal was axed .","The department in October had meetings with rival manufacturers AgustaWestland and Eurocopter, to see if they could step into the breech if the CH-148 deal was axed.",reject,0.6686700583,0
172,"__NE_FROM__ secretary Elaine Chao told the families of those killed in the 2009 __NE_TO__ flight 3407 crash there would be no change to the 1,500-hr .","US Department of Transportation  secretary Elaine Chao told the families of those killed in the 2009 Colgan Air flight 3407 crash there would be no change to the 1,500-hr.",reject,0.9775043726,0
173,__NE_FROM__ says the __NE_TO__ type certificate is the first such document to be obtained by a Russian aircraft under the framework co-operation agreement signed between the two sides in July 2004 .,Russia's Interstate Aviation Committee  says the EASA type certificate is the first such document to be obtained by a Russian aircraft under the framework co-operation agreement signed between the two sides in July 2004.,B_supplies_A,0.39943867920000004,1
174,__NE_FROM__ To Sell On __NE_TO__ .,Pink Lamborghini Espada Fails To Sell On eBay.,reject,0.6638950706,0
175,"__NE_FROM__ had said previously that the top-of-the line CLX version of the __NE_TO__ will be built in Russelsheim , Germany , in the second quarter of next year before shifting to a North American factory .","GM had said previously that the top-of-the line CLX version of the Regal will be built in Russelsheim, Germany, in the second quarter of next year before shifting to a North American factory.",B_supplies_A,0.617764473,1
176,"The others are on the Altima , __NE_FROM__ , __NE_OTHER__ , __NE_TO__ , and __NE_OTHER__ .","The others are on the Altima, NV200, Paladin, Qashqai, and Rogue.",reject,0.9530766606000001,0
177,"Focus , pickups __NE_FROM__ in San Antonio sold 2,724 vehicles to the U.S. government last year , the fifth-highest for any seller , according to __NE_TO__ .","Focus, pickups  Brasada / Northside Ford in San Antonio sold 2,724 vehicles to the U.S. government last year, the fifth-highest for any seller, according to GSA.",reject,0.6247671247000001,0
178,"In Internet , a web-radio with more than 100,000 stations from all around the world ; the __NE_FROM__ platform , containing over 35 million tracks ; __NE_OTHER__ , to keep abreast of world news ; and , of course , __NE_OTHER__ , __NE_OTHER__ and __NE_TO__ to keep in touch with friends and followers .","In Internet, a web-radio with more than 100,000 stations from all around the world; the Deezer Internet Music platform, containing over 35 million tracks; Reuters, to keep abreast of world news; and, of course, Facebook, Facebook CheckIn and Twitter to keep in touch with friends and followers.",reject,0.9679636359,0
179,"__NE_FROM__ ( NASDAQ : __NE_TO__ ) , the negotiation-free car buying and selling platform , marks a milestone this month as a majority of visitors accessed the service by mobile device rather than with a desktop or laptop computer .","TrueCar, Inc. (NASDAQ: TRUE), the negotiation-free car buying and selling platform, marks a milestone this month as a majority of visitors accessed the service by mobile device rather than with a desktop or laptop computer.",reject,0.5109829307,0
180,__NE_FROM__ to open new engine __NE_TO__ facility in Hamburg .,Lufthansa Technik to open new engine MRO facility in Hamburg.,A_supplies_B,0.4613317847,2
181,"In 2008 , the segment collapsed , prompting __NE_FROM__ to outsource future production of the pickup to __NE_TO__ .","In 2008, the segment collapsed, prompting Nissan to outsource future production of the pickup to Chrysler.",reject,0.6691291332,0
182,"Advertising agency __NE_FROM__ will create the spot , according to __NE_TO__ .","Advertising agency David&Goliath will create the spot, according to Automotive News.",reject,0.7281435728,0
183,"The business management of those plants will be transferred to the new subsidiary , named __NE_FROM__ , __NE_TO__ , the company announced 23 March .","The business management of those plants will be transferred to the new subsidiary, named Toyoda Gosei Kyushu Co., Ltd., the company announced 23 March.",reject,0.5328508019,0
184,"Currently Jacqueline Tammenoms Bakker is a Non-Executive Director of __NE_FROM__ , __NE_TO__ and __NE_OTHER__ .","Currently Jacqueline Tammenoms Bakker is a Non-Executive Director of Tesco PLC , Vivendi  and CNH Industrial .",reject,0.8239574432000001,0
185,The __NE_FROM__ model delivers near-zero emissions through the combination of the MP8 engine and __NE_TO__ ™ SCR technology .,The Pinnacle model delivers near-zero emissions through the combination of the MP8 engine and Mack ClearTech™ SCR technology.,A_supplies_B,0.3719308376,2
186,"__NE_OTHER__ is a __NE_OTHER__ card-based feature that links cars to apps and services that can analyze fuel economy , plan routes , suggest restaurants , display weather reports , take dictation , tap several music services , read custom news feeds to the driver and connect with __NE_FROM__ and __NE_TO__ .","ConnectedDrive is a SIM card-based feature that links cars to apps and services that can analyze fuel economy, plan routes, suggest restaurants, display weather reports, take dictation, tap several music services, read custom news feeds to the driver and connect with Facebook and Twitter.",reject,0.9714488983,0
187,"Additionally , __NE_FROM__ contributed to implement an __NE_TO__ at the Turfeira Lake , located next to its industrial site .","Additionally, Nissan contributed to implement an Environmental Protection Area at the Turfeira Lake, located next to its industrial site.",reject,0.5081916451,0
188,"The time limits for determining whether seats and seating systems comply with __NE_OTHER__ regulations range between two and six years , although the __NE_FROM__ __NE_OTHER__ , unlike the __NE_TO__ __NE_OTHER__ , has set a maximum limit of 10 years for replacement of affected materials installed on in-service aircraft , even if seats pass all requirements .","The time limits for determining whether seats and seating systems comply with FAA regulations range between two and six years, although the EASA AD, unlike the FAA AD, has set a maximum limit of 10 years for replacement of affected materials installed on in-service aircraft, even if seats pass all requirements.",reject,0.9652862549000001,0
189,"The ratios and gearshift calibration were developed by __NE_FROM__ to combine performance with efficient fuel consumption , while the __NE_TO__ transmission 's gear shift times have been optimised for greater performance and driving enjoyment .","The ratios and gearshift calibration were developed by Renault Sport to combine performance with efficient fuel consumption, while the EDC transmission’s gear shift times have been optimised for greater performance and driving enjoyment.",reject,0.6617383361,0
190,__NE_FROM__ figures show 53.5 % of passengers handled by UK airports were flying to or from the 27 __NE_OTHER__ member states while more than one in 10 passengers handled by its __NE_TO__ airports are flying to or from the UK .,ACI Europe figures show 53.5% of passengers handled by UK airports were flying to or from the 27 EU member states while more than one in 10 passengers handled by its EU airports are flying to or from the UK.,reject,0.9628665447,0
191,"__NE_OTHER__ , __NE_FROM__ and __NE_OTHER__ were bound to raise eyebrows around the auto industry by teaming up to buy __NE_TO__ , the dominant supplier of digital maps for in-car navigation .","Audi, BMW and Daimler were bound to raise eyebrows around the auto industry by teaming up to buy Here, the dominant supplier of digital maps for in-car navigation.",reject,0.8816666603000001,0
192,__NE_FROM__ also notes that __NE_TO__ might find it difficult to recoup the € 50 million cost of modifying the 200 for European standards because the car 's platform will be replaced by a Fiat-designed chassis in 2013 .,ANE also notes that Fiat might find it difficult to recoup the €50 million cost of modifying the 200 for European standards because the car's platform will be replaced by a Fiat-designed chassis in 2013.,reject,0.5997474194,0
193,"Based on the results of the field test that will be held from October 2013 to March 2014 , __NE_FROM__ and __NE_TO__ will consider commercializing this system .","Based on the results of the field test that will be held from October 2013 to March 2014, DENSO and Nagoya University will consider commercializing this system.",reject,0.8717709184,0
194,"Speaking with __NE_FROM__ , the head honcho at __NE_TO__ confirmed Project Cullinan ( name not final ) will ride on the same new platform that has underpinned the 2018 Phantom , but that was far from being the most interesting part of the interview .","Speaking with Automotive News, the head honcho at RR confirmed Project Cullinan (name not final) will ride on the same new platform that has underpinned the 2018 Phantom, but that was far from being the most interesting part of the interview.",reject,0.8514429331000001,0
195,"We are proud to be able to support the __NE_FROM__ in protecting their coastline and ensuring the safety and security of their seas , "" says Thomas Imke , regional sales director at __NE_TO__ .","We are proud to be able to support the Bangladesh Navy in protecting their coastline and ensuring the safety and security of their seas,"" says Thomas Imke, regional sales director at RUAG Aviation.",reject,0.7405843735000001,0
196,"__NE_FROM__ CEO Dan Akerson originally touted the __NE_TO__ gasoline-and-electric system as the technology of the future and forecast global Volt sales of 60,000 in 2012 , before settling for half that amount .","GM CEO Dan Akerson originally touted the Volt's gasoline-and-electric system as the technology of the future and forecast global Volt sales of 60,000 in 2012, before settling for half that amount.",reject,0.8070745468,0
197,"__NE_FROM__ is __NE_OTHER__ second add-on acquisition and follows the recent acquisition of __NE_TO__ , a provider of advanced composites solutions for aerospace and defense applications , in November 2017. .","ECS is AC&A’s second add-on acquisition and follows the recent acquisition of Applied Composites Engineering Inc., a provider of advanced composites solutions for aerospace and defense applications, in November 2017..",B_supplies_A,0.3903434873,1
198,"The company was to receive the first of five __NE_FROM__ transports in August 2008 under a subcontract with __NE_TO__ , but this should now arrive later this year .","The company was to receive the first of five Royal New Zealand Air Force transports in August 2008 under a subcontract with L-3 Communications, but this should now arrive later this year.",reject,0.8716694713,0
199,The week-long evaluation - conducted in partnership with __NE_OTHER__ and sister company __NE_FROM__ from __NE_TO__ in Austria - covered different radar modes at a range of altitudes and speeds .,The week-long evaluation - conducted in partnership with Diamond Aircraft and sister company Diamond Airborne Sensing from Wiener Neustadt in Austria - covered different radar modes at a range of altitudes and speeds.,reject,0.4261925519,0
